{
  "$schema": "https://json-schema.org/draft/2020-12/schema",
  "type": "object",
  "properties": {
    "schema_version": {
      "type": "number",
      "const": 1
    },
    "date": {
      "type": "string",
      "format": "date",
      "pattern": "^(?:(?:\\d\\d[2468][048]|\\d\\d[13579][26]|\\d\\d0[48]|[02468][048]00|[13579][26]00)-02-29|\\d{4}-(?:(?:0[13578]|1[02])-(?:0[1-9]|[12]\\d|3[01])|(?:0[469]|11)-(?:0[1-9]|[12]\\d|30)|(?:02)-(?:0[1-9]|1\\d|2[0-8])))$"
    },
    "generated_at": {
      "type": "string",
      "format": "date-time",
      "pattern": "^(?:(?:\\d\\d[2468][048]|\\d\\d[13579][26]|\\d\\d0[48]|[02468][048]00|[13579][26]00)-02-29|\\d{4}-(?:(?:0[13578]|1[02])-(?:0[1-9]|[12]\\d|3[01])|(?:0[469]|11)-(?:0[1-9]|[12]\\d|30)|(?:02)-(?:0[1-9]|1\\d|2[0-8])))T(?:(?:[01]\\d|2[0-3]):[0-5]\\d:[0-5]\\d(?:\\.\\d+)?(?:Z))$"
    },
    "lead_story": {
      "type": "string"
    },
    "sections": {
      "type": "object",
      "propertyNames": {
        "type": "string"
      },
      "additionalProperties": {
        "type": "array",
        "items": {
          "type": "string"
        }
      }
    },
    "newsletter": {
      "oneOf": [
        {
          "type": "object",
          "properties": {
            "status": {
              "type": "string",
              "const": "draft"
            },
            "subject": {
              "type": "string",
              "minLength": 1,
              "maxLength": 120
            },
            "preview_text": {
              "type": "string",
              "minLength": 1,
              "maxLength": 200
            }
          },
          "required": [
            "status",
            "subject",
            "preview_text"
          ],
          "additionalProperties": false
        },
        {
          "type": "object",
          "properties": {
            "status": {
              "type": "string",
              "const": "approved"
            },
            "subject": {
              "type": "string",
              "minLength": 1,
              "maxLength": 120
            },
            "preview_text": {
              "type": "string",
              "minLength": 1,
              "maxLength": 200
            },
            "approved_by": {
              "type": "string",
              "minLength": 1
            },
            "approved_at": {
              "type": "string",
              "format": "date-time",
              "pattern": "^(?:(?:\\d\\d[2468][048]|\\d\\d[13579][26]|\\d\\d0[48]|[02468][048]00|[13579][26]00)-02-29|\\d{4}-(?:(?:0[13578]|1[02])-(?:0[1-9]|[12]\\d|3[01])|(?:0[469]|11)-(?:0[1-9]|[12]\\d|30)|(?:02)-(?:0[1-9]|1\\d|2[0-8])))T(?:(?:[01]\\d|2[0-3]):[0-5]\\d:[0-5]\\d(?:\\.\\d+)?(?:Z))$"
            }
          },
          "required": [
            "status",
            "subject",
            "preview_text",
            "approved_by",
            "approved_at"
          ],
          "additionalProperties": false
        }
      ]
    },
    "fixture": {
      "type": "boolean",
      "const": true
    },
    "stories": {
      "type": "array",
      "items": {
        "type": "object",
        "properties": {
          "id": {
            "type": "string",
            "minLength": 1
          },
          "slug": {
            "type": "string",
            "pattern": "^[a-z0-9]+(?:-[a-z0-9]+)*$"
          },
          "title": {
            "type": "string",
            "minLength": 1
          },
          "type": {
            "type": "string",
            "enum": [
              "news",
              "cve",
              "research",
              "original",
              "incident",
              "explainer",
              "tool",
              "advisory"
            ]
          },
          "category": {
            "type": "string",
            "enum": [
              "vulnerabilities",
              "supply-chain",
              "ai-security",
              "appsec",
              "cloud",
              "research",
              "security-engineering"
            ]
          },
          "published_at": {
            "type": "string",
            "format": "date-time",
            "pattern": "^(?:(?:\\d\\d[2468][048]|\\d\\d[13579][26]|\\d\\d0[48]|[02468][048]00|[13579][26]00)-02-29|\\d{4}-(?:(?:0[13578]|1[02])-(?:0[1-9]|[12]\\d|3[01])|(?:0[469]|11)-(?:0[1-9]|[12]\\d|30)|(?:02)-(?:0[1-9]|1\\d|2[0-8])))T(?:(?:[01]\\d|2[0-3]):[0-5]\\d:[0-5]\\d(?:\\.\\d+)?(?:Z))$"
          },
          "updated_at": {
            "anyOf": [
              {
                "type": "string",
                "format": "date-time",
                "pattern": "^(?:(?:\\d\\d[2468][048]|\\d\\d[13579][26]|\\d\\d0[48]|[02468][048]00|[13579][26]00)-02-29|\\d{4}-(?:(?:0[13578]|1[02])-(?:0[1-9]|[12]\\d|3[01])|(?:0[469]|11)-(?:0[1-9]|[12]\\d|30)|(?:02)-(?:0[1-9]|1\\d|2[0-8])))T(?:(?:[01]\\d|2[0-3]):[0-5]\\d:[0-5]\\d(?:\\.\\d+)?(?:Z))$"
              },
              {
                "type": "null"
              }
            ]
          },
          "summary": {
            "type": "string",
            "minLength": 1
          },
          "why_it_matters": {
            "type": "string",
            "minLength": 1
          },
          "action": {
            "type": "string",
            "minLength": 1
          },
          "affected_technologies": {
            "default": [],
            "type": "array",
            "items": {
              "type": "string"
            }
          },
          "tags": {
            "type": "array",
            "items": {
              "type": "string",
              "pattern": "^[a-z0-9]+(?:-[a-z0-9]+)*$"
            }
          },
          "sources": {
            "type": "array",
            "items": {
              "type": "object",
              "properties": {
                "id": {
                  "type": "string",
                  "minLength": 1
                },
                "name": {
                  "type": "string",
                  "minLength": 1
                },
                "url": {
                  "type": "string",
                  "format": "uri"
                },
                "type": {
                  "type": "string",
                  "enum": [
                    "vendor",
                    "government",
                    "research",
                    "community",
                    "editorial"
                  ]
                },
                "published_at": {
                  "anyOf": [
                    {
                      "type": "string",
                      "format": "date-time",
                      "pattern": "^(?:(?:\\d\\d[2468][048]|\\d\\d[13579][26]|\\d\\d0[48]|[02468][048]00|[13579][26]00)-02-29|\\d{4}-(?:(?:0[13578]|1[02])-(?:0[1-9]|[12]\\d|3[01])|(?:0[469]|11)-(?:0[1-9]|[12]\\d|30)|(?:02)-(?:0[1-9]|1\\d|2[0-8])))T(?:(?:[01]\\d|2[0-3]):[0-5]\\d:[0-5]\\d(?:\\.\\d+)?(?:Z))$"
                    },
                    {
                      "type": "null"
                    }
                  ]
                },
                "retrieved_at": {
                  "type": "string",
                  "format": "date-time",
                  "pattern": "^(?:(?:\\d\\d[2468][048]|\\d\\d[13579][26]|\\d\\d0[48]|[02468][048]00|[13579][26]00)-02-29|\\d{4}-(?:(?:0[13578]|1[02])-(?:0[1-9]|[12]\\d|3[01])|(?:0[469]|11)-(?:0[1-9]|[12]\\d|30)|(?:02)-(?:0[1-9]|1\\d|2[0-8])))T(?:(?:[01]\\d|2[0-3]):[0-5]\\d:[0-5]\\d(?:\\.\\d+)?(?:Z))$"
                }
              },
              "required": [
                "id",
                "name",
                "url",
                "type",
                "retrieved_at"
              ],
              "additionalProperties": false
            }
          },
          "signal": {
            "type": "object",
            "properties": {
              "score": {
                "type": "number",
                "minimum": 0,
                "maximum": 100
              },
              "label": {
                "type": "string",
                "enum": [
                  "standard",
                  "recommended",
                  "must-read"
                ]
              },
              "reasons": {
                "type": "array",
                "items": {
                  "type": "string"
                }
              }
            },
            "required": [
              "score",
              "label",
              "reasons"
            ],
            "additionalProperties": false
          },
          "vulnerabilities": {
            "default": [],
            "type": "array",
            "items": {
              "type": "object",
              "properties": {
                "cve": {
                  "type": "string",
                  "pattern": "^CVE-\\d{4}-\\d{4,}$"
                },
                "ghsa": {
                  "anyOf": [
                    {
                      "type": "string",
                      "pattern": "^GHSA-[23456789cfghjmpqrvwx]{4}-[23456789cfghjmpqrvwx]{4}-[23456789cfghjmpqrvwx]{4}$"
                    },
                    {
                      "type": "null"
                    }
                  ]
                },
                "cvss": {
                  "anyOf": [
                    {
                      "type": "number",
                      "minimum": 0,
                      "maximum": 10
                    },
                    {
                      "type": "null"
                    }
                  ]
                },
                "cvss_version": {
                  "type": [
                    "string",
                    "null"
                  ]
                },
                "epss": {
                  "anyOf": [
                    {
                      "type": "number",
                      "minimum": 0,
                      "maximum": 1
                    },
                    {
                      "type": "null"
                    }
                  ]
                },
                "epss_percentile": {
                  "anyOf": [
                    {
                      "type": "number",
                      "minimum": 0,
                      "maximum": 1
                    },
                    {
                      "type": "null"
                    }
                  ]
                },
                "kev": {
                  "type": [
                    "boolean",
                    "null"
                  ]
                },
                "exploitation": {
                  "default": "unknown",
                  "type": "string",
                  "enum": [
                    "confirmed",
                    "not-confirmed",
                    "unknown"
                  ]
                },
                "affected": {
                  "default": [],
                  "type": "array",
                  "items": {
                    "type": "string"
                  }
                },
                "fixed_versions": {
                  "default": [],
                  "type": "array",
                  "items": {
                    "type": "string"
                  }
                },
                "evidence_date": {
                  "anyOf": [
                    {
                      "type": "string",
                      "format": "date",
                      "pattern": "^(?:(?:\\d\\d[2468][048]|\\d\\d[13579][26]|\\d\\d0[48]|[02468][048]00|[13579][26]00)-02-29|\\d{4}-(?:(?:0[13578]|1[02])-(?:0[1-9]|[12]\\d|3[01])|(?:0[469]|11)-(?:0[1-9]|[12]\\d|30)|(?:02)-(?:0[1-9]|1\\d|2[0-8])))$"
                    },
                    {
                      "type": "null"
                    }
                  ]
                }
              },
              "required": [
                "cve",
                "exploitation",
                "affected",
                "fixed_versions"
              ],
              "additionalProperties": false
            }
          },
          "illustration": {
            "type": [
              "string",
              "null"
            ]
          },
          "body": {
            "default": [],
            "type": "array",
            "items": {
              "type": "string"
            }
          },
          "author": {
            "type": [
              "string",
              "null"
            ]
          },
          "fixture": {
            "type": "boolean",
            "const": true
          }
        },
        "required": [
          "id",
          "slug",
          "title",
          "type",
          "category",
          "published_at",
          "summary",
          "why_it_matters",
          "action",
          "affected_technologies",
          "tags",
          "sources",
          "signal",
          "vulnerabilities",
          "body",
          "fixture"
        ],
        "additionalProperties": false
      }
    }
  },
  "required": [
    "schema_version",
    "date",
    "lead_story",
    "sections",
    "fixture",
    "stories"
  ],
  "additionalProperties": false
}
